{
  "schema_version": "0.0.0",
  "trace_id": "8c9b1c2d-3e4f-4a5b-8c9d-1e2f3a4b5c6d",
  "run_id": "3f0e3a9d-4d3c-4e4a-8d7e-2f6c2a3f9d1b",
  "events": [
    {
      "event_id": "a1111111-2222-4333-8444-555555555555",
      "ts": "2026-02-03T19:30:01Z",
      "type": "step_started",
      "step": "A1_intake_extraction",
      "message": "Starting extraction from untrusted intake text (synthetic)."
    },
    {
      "event_id": "b1111111-2222-4333-8444-555555555555",
      "ts": "2026-02-03T19:30:02Z",
      "type": "tool_call",
      "step": "A1_intake_extraction",
      "tool_name": "medgemma_extract_intake",
      "args_redacted": {
        "input_hash": "sha256:deadbeef"
      }
    },
    {
      "event_id": "c1111111-2222-4333-8444-555555555555",
      "ts": "2026-02-03T19:30:03Z",
      "type": "tool_result",
      "step": "A1_intake_extraction",
      "tool_name": "medgemma_extract_intake",
      "result_summary": "Structured symptoms extracted and validated against schema."
    },
    {
      "event_id": "d1111111-2222-4333-8444-555555555555",
      "ts": "2026-02-03T19:30:04Z",
      "type": "step_completed",
      "step": "A1_intake_extraction",
      "message": "Extraction completed (synthetic)."
    },
    {
      "event_id": "e1111111-2222-4333-8444-555555555555",
      "ts": "2026-02-03T19:30:05Z",
      "type": "finalized",
      "message": "Run completed (synthetic demo)."
    }
  ]
}

